{
  "schema_version": "outbound.v1",
  "user_id": "usr_demo0001",
  "idempotency_key": "brief-usr_demo0001-2026-08-02",
  "blocks": [
    {
      "type": "text",
      "text": "3 people are waiting on you.\n\n1. Maya — asked you something 12 days ago\n2. Yu — used to reply in 16 seconds. It's been 51 days.\n3. Mom — opens two of every three conversations"
    }
  ],
  "reply_to_message_id": null,
  "requested_capabilities": [
    "threading",
    "tapbacks"
  ]
}
